{
  "schema_version": 1,
  "verification_id": "VER-P0F-DELIVERY",
  "requirement_ids": [],
  "phase": "P0F",
  "scenario_id": "p0f-delivery-matrix",
  "git_commit": "14ffd6990fdf30577f93e995b9d9612bcf20c6e0",
  "git_dirty": true,
  "build_id": "p0f-14ffd69",
  "environment": {
    "id": "cosmic-native",
    "native_or_vm": "native",
    "os": "Pop!_OS",
    "os_version": "Pop!_OS 24.04 LTS",
    "kernel": "7.0.11-76070011-generic",
    "desktop": "COSMIC",
    "session": "wayland",
    "cpu": "Intel(R) Core(TM) Ultra 9 288V",
    "gpu": "Intel(R) Graphics (LNL)",
    "npu": "/dev/accel0 (intel_vpu)",
    "microphone": "alsa_input.pci-0000_00_1f.3-platform-skl_hda_dsp_generic.HiFi__Mic1__source"
  },
  "command": "python3 tools/p0f-probes/probe-delivery.py",
  "scenario_hash": "5478d926b80d378c30989cdf21ace546c7bbd70d7a603718de733c21d591d9a2",
  "started_at": "2026-08-22T10:57:27.089136+00:00",
  "ended_at": "2026-08-22T10:57:27.118794+00:00",
  "exit_code": 0,
  "result": "pass",
  "pass": true,
  "metrics": {
    "backends": {
      "libei_eis_available": false,
      "wl_clipboard": {
        "wl_copy": false,
        "wl_paste": false,
        "available": false
      },
      "wtype_available": true,
      "xclip_available": false,
      "xsel_available": false,
      "uinput_present": true,
      "uinput_in_input_group": true,
      "atspi_available": false
    },
    "targets_installed": {
      "COSMIC Edit": true,
      "GNOME Text Editor": false,
      "COSMIC Terminal": true,
      "GNOME Terminal": false,
      "Firefox": true,
      "Chromium": false,
      "Brave": true,
      "Chrome": false,
      "VS Code": true,
      "Electron generic": false,
      "XWayland_running": true
    },
    "fixtures": {
      "ascii": {
        "len_chars": 15,
        "len_bytes": 15,
        "roundtrip_ok": true
      },
      "accented": {
        "len_chars": 24,
        "len_bytes": 29,
        "roundtrip_ok": true
      },
      "emoji": {
        "len_chars": 22,
        "len_bytes": 31,
        "roundtrip_ok": true
      },
      "urdu_arabic": {
        "len_chars": 26,
        "len_bytes": 48,
        "roundtrip_ok": true
      },
      "cjk": {
        "len_chars": 16,
        "len_bytes": 44,
        "roundtrip_ok": true
      },
      "multiline": {
        "len_chars": 47,
        "len_bytes": 47,
        "roundtrip_ok": true
      },
      "punctuation": {
        "len_chars": 57,
        "len_bytes": 61,
        "roundtrip_ok": true
      },
      "large_5k": {
        "len_chars": 5120,
        "len_bytes": 5120,
        "roundtrip_ok": true
      }
    },
    "per_backend_matrix": {
      "input-method/native_text_commit": {
        "permission_model": "portal/compositor mediated; no broad input privilege",
        "unicode": "utf-8 native if supported",
        "multiline": "capability-dependent per app",
        "layout_dependence": "none (commits text, not keys)",
        "focus_requirements": "target must have text input focus",
        "verification_possible": false,
        "clipboard_impact": "none",
        "failure_detection": "per-protocol ack or timeout",
        "fallback": "clipboard -> inbox",
        "current_host_available": false,
        "notes": "requires compositor text-input support and client integration; not generic injection \u2014 must be qualified per lane"
      },
      "accessibility/automation": {
        "permission_model": "AT-SPI a11y bus; not broad input",
        "unicode": "where app exposes editable text",
        "multiline": "per-app",
        "layout_dependence": "none",
        "focus_requirements": "a11y focus",
        "verification_possible": false,
        "clipboard_impact": "none",
        "failure_detection": "a11y error",
        "fallback": "clipboard -> inbox",
        "current_host_available": false,
        "notes": "AT-SPI present but not qualified as reliable delivery for 1.0"
      },
      "virtual-keyboard/keyboard-emulation": {
        "permission_model": "compositor virtual keyboard (zwp_virtual_keyboard via wtype) or libei/EIS; not uinput by default",
        "unicode": "limited \u2014 key symbols are layout dependent; emoji/composite glyphs unreliable",
        "multiline": "per-key emission; large text problematic",
        "layout_dependence": "yes",
        "focus_requirements": "focus required",
        "verification_possible": false,
        "clipboard_impact": "none",
        "failure_detection": "no insertion ack; bounded timeout",
        "fallback": "clipboard -> inbox",
        "current_host_available": true,
        "notes": "wtype present=True (v0.4 daemon proved this mechanism on this host class); libei=False"
      },
      "clipboard+paste": {
        "permission_model": "Wayland data-control/clipboard; transient ownership, bounded timeout",
        "unicode": "full (UTF-8 MIME)",
        "multiline": "full",
        "layout_dependence": "paste-chord variance only",
        "focus_requirements": "focus + correct paste chord",
        "verification_possible": "limited \u2014 clipboard ownership check, no insertion ack",
        "clipboard_impact": "overwrites clipboard unless preserved with verified ownership",
        "failure_detection": "set-ok but paste unverified; timeout to Inbox",
        "fallback": "Inbox",
        "current_host_available": false,
        "notes": "transactional semantics required: journal before overwrite, restore only while ownership is still ours"
      },
      "Inbox": {
        "permission_model": "none \u2014 no target injection",
        "unicode": "full",
        "multiline": "full",
        "layout_dependence": "none",
        "focus_requirements": "none",
        "verification_possible": true,
        "clipboard_impact": "none",
        "failure_detection": "journal durability",
        "fallback": "itself (final)",
        "current_host_available": true,
        "notes": "always-available safe sink; never loses final text"
      }
    },
    "summary": {
      "semantic_available": false,
      "wtype_available": true,
      "libei_available": false,
      "clipboard_available": false,
      "uinput_present": true,
      "uinput_is_default": false,
      "unicode_all_fixtures_roundtrip": true,
      "inbox_fallback_always_available": true
    }
  },
  "artifact_hashes": {},
  "diagnostic_ref": null,
  "diagnostic_excerpt": "wtype=True wl_clip=False unicode=True",
  "tester": "autonomous-agent",
  "notes": "Delivery matrix probe: backend/tool capability truth + Unicode fixtures + per-backend matrix. Backends: wtype=True wl-clipboard=False libei=False atspi=False uinput_present=True in_input_group=True. Unicode fixtures (ascii/accented/emoji/urdu-arabic/cjk/multiline/punctuation/large_5k): all UTF-8 roundtrips pass=True. Router order stays semantic -> virtual-keyboard/clipboard transaction -> Inbox; uinput is opt-in only and never the default onboarding path. Real per-target insertion evidence (native Wayland editor, browser, Electron, terminal, XWayland) is collected during P0F execution with a focused target; this probe records backend/tool truth only."
}
