{
  "schema_version": 1,
  "verification_id": "VER-P0F-TARGET",
  "requirement_ids": [],
  "phase": "P0F",
  "scenario_id": "p0f-target-identity",
  "git_commit": "14ffd6990fdf30577f93e995b9d9612bcf20c6e0",
  "git_dirty": true,
  "build_id": "p0f-14ffd69",
  "environment": {
    "id": "cosmic-native",
    "native_or_vm": "native",
    "os": "Pop!_OS",
    "os_version": "Pop!_OS 24.04 LTS",
    "kernel": "7.0.11-76070011-generic",
    "desktop": "COSMIC",
    "session": "wayland",
    "cpu": "Intel(R) Core(TM) Ultra 9 288V",
    "gpu": "Intel(R) Graphics (LNL)",
    "npu": "/dev/accel0 (intel_vpu)",
    "microphone": "alsa_input.pci-0000_00_1f.3-platform-skl_hda_dsp_generic.HiFi__Mic1__source"
  },
  "command": "python3 tools/p0f-probes/probe-target-identity.py",
  "scenario_hash": "f9adebd1140f93d6df9512a19f0bff373eca88bd278518a817415bee83a0f863",
  "started_at": "2026-08-22T10:57:27.302747+00:00",
  "ended_at": "2026-08-22T10:57:27.336525+00:00",
  "exit_code": 0,
  "result": "pass",
  "pass": true,
  "metrics": {
    "window_identity": {
      "cosmic_comp_introspect_success": true,
      "cosmic_comp_has_window_api": false,
      "wmctrl_available": false,
      "xdotool_available": false,
      "xprop_available": true,
      "atspi_bus_address_present": false,
      "running_apps_sample": [
        "cosmic-comp",
        "firefox",
        "brave",
        "code",
        "cosmic-term"
      ],
      "generic_wayland_window_identity_available": false,
      "xwayland_window_identity_available": true
    },
    "selection_surrounding": {
      "wl_copy_available": false,
      "wl_paste_available": false,
      "xclip_available": false,
      "libei_available": false,
      "portal_has_text_input": false,
      "selection_discovery_available": false,
      "surrounding_text_available": false
    },
    "summary": {
      "app_window_id_available": false,
      "xwayland_window_available": true,
      "selection_available": false,
      "surrounding_available": false,
      "fallback_required": true,
      "permission_required": "compositor-specific or a11y; no generic portal window-identity interface on this host"
    }
  },
  "artifact_hashes": {},
  "diagnostic_ref": null,
  "diagnostic_excerpt": "window=False selection=False fallback required",
  "tester": "autonomous-agent",
  "notes": "Target identity probe: app/window identity and selection/surrounding truth. Window/app identity: generic Wayland=False (truthfully unavailable without compositor/a11y cooperation); XWayland tools present=['xprop_available']; cosmic-comp window API introspectable=True; atspi_bus=False. Selection/surrounding: wl_copy=False libei=False portal_text_input=False selection=False surrounding=False. Fallback semantics: when identity is missing/ambiguous the delivery router must still deliver to the focused target or Inbox \u2014 dictation is never blocked on identity; 'unknown target' is an explicit state, never a silent failure."
}
