{
  "schema_version": 1,
  "verification_id": "VER-OPS-002",
  "requirement_ids": [
    "OPS-002"
  ],
  "phase": "P10",
  "scenario_id": "p10-deb-install",
  "git_commit": "14ffd6990fdf30577f93e995b9d9612bcf20c6e0",
  "git_dirty": true,
  "build_id": "p10-14ffd69",
  "environment": {
    "id": "cosmic-p10",
    "native_or_vm": "native",
    "os": "Pop!_OS",
    "os_version": "Pop!_OS 24.04 LTS",
    "kernel": "7.0.11-76070011-generic",
    "desktop": "COSMIC",
    "session": "wayland",
    "cpu": "x86_64",
    "gpu": null,
    "npu": null,
    "microphone": null,
    "device_details": null
  },
  "command": "python3 tools/narrivy-qualify/p10_runner.py --scenario p10-deb-install",
  "scenario_hash": "9b06be27ea42d8a677d1e9b3cb8df7327c51782b057d1cf8b9dd3d5ca27e639d",
  "started_at": "2026-08-26T06:44:51.021378+00:00",
  "ended_at": "2026-08-26T06:44:51.992164+00:00",
  "exit_code": 0,
  "result": "pass",
  "pass": true,
  "metrics": {
    "deb_path": "artifacts/releases/narrivy_0.1.0_amd64.deb",
    "deb_size": 38399850,
    "deb_sha256": "bc15dbf6a42a446bbb1d04f1a46edc77a69bf35f163affaffbd7eca2a1c1f3dc",
    "deb_found": true,
    "dpkg_info_rc": 0,
    "build_using_present": true,
    "deb_version": "0.1.0",
    "contents_rc": 0,
    "missing_paths": [],
    "all_required_paths_present": true,
    "perm_issues": [],
    "permissions_ok": true,
    "build_info_inside_deb": true,
    "build_info_commit": "43566ebea4f8",
    "build_info_version": "0.1.0",
    "build_info_has_toolchain": true,
    "commit_matches": true,
    "source_date_epoch": "1787726497",
    "reproducible_epoch_set": true
  },
  "artifact_hashes": {
    "artifacts/sbom/spdx.json": "dc869aff657882ebb9c1966d7275c31715a9f68d98c3403a11630f7b7632fa54",
    "artifacts/releases/narrivy_0.1.0_amd64.deb": "bc15dbf6a42a446bbb1d04f1a46edc77a69bf35f163affaffbd7eca2a1c1f3dc",
    "artifacts/release-evidence/linux-1.0/release-artifacts.json": "9761b5408ea5e646092b41059ac43fb36ed4a1c7ac3337874b5428314ce1eec8"
  },
  "diagnostic_ref": null,
  "diagnostic_excerpt": "deb narrivy_0.1.0_amd64.deb bc15dbf6a42a\n new Debian package, version 2.0.\n size 38399850 bytes: control archive=1332 bytes.\n     620 bytes,    14 lines      control\n     811 bytes,    24 lines   *  postinst             #!/bin/sh\n     874 bytes,    24 lines   *  postrm               #!/bin/sh\n     325 bytes,    14 lines   *  prerm                #!/bin/sh\n Package: narrivy\n Version: 0.1.0\n Section: utils\n Priority: optional\n Architecture: amd64\n Maintainer: Narrivy <release@narrivy.local>\n Description: Narrivy \u2014 local-first voice dictation for Linux\n  Fast, private dictation that runs locally on your machine.\n  Uses PipeWire for capture, local ASR (Qwen3-ASR/Parakeet/Whisper via transcribe.cpp)\n  and capability-driven delivery without cloud by default.\n Depends: libwebkit2gtk-4.1-0, libayatana-appindicator3-1 | libappindicator3-1\ndrwx------ root/root         0 2026-08-26 11:41 ./\ndrwxr-xr-x root/root         0 2026-08-26 11:41 ./usr/\ndrwxr-xr-x root/root         0 2026-08-26 11:41 ./usr/bin/\n-rwxr-xr-x root/root  10823224 2026-08-26 11:41 ./usr/bin/narrivy-cli\n-rwxr-xr-x root/root 213746128 2026-08-26 11:41 ./usr/bin/narrivy-desktop\n-rwxr-xr-x root/root  31595456 2026-08-26 11:41 ./usr/bin/narrivyd\ndrwxr-xr-x root/root         0 2026-08-26 11:41 ./usr/lib/\ndrwxr-xr-x root/root         0 2026-08-26 11:41 ./usr/lib/systemd/\ndrwxr-xr-x root/root         0 2026-08-26 11:41 ./usr/lib/systemd/user/\n-rw-r--r-- root/root       715 2026-08-26 11:41 ./usr/lib/systemd/user/narrivy-daemon.service\ndrwxr-xr-x root/root         0 2026-08-26 11:41 ./usr/share/\ndrwxr-xr-x root/root         0 2026-08-26 11:41 ./usr/share/applications/\n-rw-r--r-- root/root       266 2026-08-26 11:41 ./usr/share/applications/narrivy.desktop\ndrwxr-xr-x root/root         0 2026-08-26 11:41 ./usr/share/doc/\ndrwxr-xr-x root/root         0 2026-08-26 11:41 ./usr/share/doc/narrivy/\n-rw-r--r-- root/root      1490 2026-08-26 11:41 ./usr/share/doc/narrivy/THIRD_PARTY_NOTICES.md\n-rw-r--r-- root/root       241 2026-08-26 11:41 ./usr/share/doc/narrivy/changelog.gz\n-rw-r--r-- root/root      1064 2026-08-26 11:41 ./usr/share/doc/narrivy/copyright\ndrwxr-xr-x root/root         0 2026-08-26 11:41 ./usr/share/icons/\ndrwxr-xr-x root/root         0 2026-08-26 11:41 ./usr/share/icons/hicolor/\ndrwxr-xr-x root/root         0 2026-08-26 11:41 ./usr/share/icons/hicolor/128x128/\ndrwxr-xr-x root/root         0 2026-08-26 11:41 ./usr/share/icons/hicolor/128x128/apps/\n-rw-r--r-- root/root       394 2026-08-26 11:41 ./usr/share/icons/hicolor/128x128/apps/narrivy.png\ndrwxr-xr-x root/root         0 2026-08-26 11:41 ./usr/share/icons/hicolor/256x256/\ndrwxr-xr-x root/root         0 2026-08-26 11:41 ./usr/share/icons/hicolor/256x256/apps/\n-rw-r--r-- root/root       858 2026-08-26 11:41 ./usr/share/icons/hicolor/256x256/apps/narrivy.png\ndrwxr-xr-x root/root      ",
  "tester": "autonomous-agent",
  "notes": "deb version 0.1.0"
}
